{
  "record_id": "REPLACE-unique-record-id",
  "candidate_id": "REPLACE-candidate-id",
  "recorded_at": null,
  "status": "REGISTERED",
  "supersedes_record_id": null,
  "baseline_commit": null,
  "challenger_commit": null,
  "strategy_version": null,
  "evidence_hash": null,
  "registered_at": null,
  "evaluation_start": null,
  "evaluation_end": null,
  "review_date": null,
  "primary_metric": null,
  "minimum_effect": null,
  "decision_rule": null,
  "guardrails": [],
  "session_calendar": "XNYS",
  "source_and_session_basis": null,
  "episode_definition": null,
  "overlap_policy": null,
  "cost_and_delay_assumptions": null,
  "multiplicity_and_stopping_plan": null,
  "exclusion_rules": [],
  "results": {
    "sessions": 0,
    "eligible_episodes": 0,
    "independent_episode_count": null,
    "coverage": null,
    "primary_effect": null,
    "confidence_interval": null,
    "session_cluster_method": null,
    "guardrail_results": [],
    "cost_stress_results": [],
    "calibration": null,
    "failures": []
  },
  "decision": null,
  "reviewed_by": null,
  "reviewed_at": null,
  "promotion_pr": null,
  "rollback_commit": null
}
